[
  {
    "id": "COMPONENT-10001",
    "type": "Component",
    "label": "Keyword Retriever",
    "sourceDataFile": "data/components/keyword-retriever.json",
    "properties": {
      "abstractionLevel": "Conceptual",
      "componentType": "Retriever",
      "interfaceRole": "Producer",
      "keywords": [
        "keyword retrieval",
        "lexical matching",
        "retriever"
      ],
      "language": "en",
      "metadataStatus": "Draft",
      "ragStages": [
        "Retrieval"
      ],
      "reviewState": "Not Reviewed",
      "schema": "schema/component.schema.json",
      "slug": "keyword-retriever",
      "status": "Draft",
      "summary": "A Keyword Retriever retrieves candidates using lexical or keyword-oriented matching signals.",
      "version": "1.0.0",
      "visibility": "Public"
    }
  },
  {
    "id": "COMPONENT-10002",
    "type": "Component",
    "label": "Semantic Retriever",
    "sourceDataFile": "data/components/semantic-retriever.json",
    "properties": {
      "abstractionLevel": "Conceptual",
      "componentType": "Retriever",
      "interfaceRole": "Producer",
      "keywords": [
        "semantic retrieval",
        "embedding retrieval",
        "retriever"
      ],
      "language": "en",
      "metadataStatus": "Draft",
      "ragStages": [
        "Retrieval"
      ],
      "reviewState": "Not Reviewed",
      "schema": "schema/component.schema.json",
      "slug": "semantic-retriever",
      "status": "Draft",
      "summary": "A Semantic Retriever retrieves candidates using semantic representations such as embeddings.",
      "version": "1.0.0",
      "visibility": "Public"
    }
  },
  {
    "id": "COMPONENT-10003",
    "type": "Component",
    "label": "Rank Fusion",
    "sourceDataFile": "data/components/rank-fusion.json",
    "properties": {
      "abstractionLevel": "Conceptual",
      "componentType": "Retriever",
      "interfaceRole": "Transformer",
      "keywords": [
        "rank fusion",
        "result merging",
        "retrieval"
      ],
      "language": "en",
      "metadataStatus": "Draft",
      "ragStages": [
        "Retrieval"
      ],
      "reviewState": "Not Reviewed",
      "schema": "schema/component.schema.json",
      "slug": "rank-fusion",
      "status": "Draft",
      "summary": "Rank Fusion combines or reconciles ranked result lists from multiple retrieval signals.",
      "version": "1.0.0",
      "visibility": "Public"
    }
  },
  {
    "id": "COMPONENT-10004",
    "type": "Component",
    "label": "Cross-Encoder Reranker",
    "sourceDataFile": "data/components/cross-encoder-reranker.json",
    "properties": {
      "abstractionLevel": "Conceptual",
      "componentType": "Reranker",
      "interfaceRole": "Transformer",
      "keywords": [
        "cross encoder",
        "reranker",
        "candidate scoring"
      ],
      "language": "en",
      "metadataStatus": "Draft",
      "ragStages": [
        "Reranking"
      ],
      "reviewState": "Not Reviewed",
      "schema": "schema/component.schema.json",
      "slug": "cross-encoder-reranker",
      "status": "Draft",
      "summary": "A Cross-Encoder Reranker scores query-candidate pairs jointly for reranking.",
      "version": "1.0.0",
      "visibility": "Public"
    }
  },
  {
    "id": "RERANKER-10001",
    "type": "Reranker",
    "label": "Cross-Encoder Reranker",
    "sourceDataFile": "data/rerankers/cross-encoder-reranker.json",
    "properties": {
      "capabilities": [
        "Semantic Relevance Scoring",
        "Passage Reranking",
        "Query Document Matching"
      ],
      "inputModalities": [
        "Text"
      ],
      "keywords": [
        "cross encoder reranking",
        "query candidate scoring",
        "reranking"
      ],
      "language": "en",
      "metadataStatus": "Draft",
      "ragStages": [
        "Reranking"
      ],
      "rerankerType": "Cross Encoder",
      "reviewState": "Not Reviewed",
      "schema": "schema/reranker.schema.json",
      "scoringApproach": "Pairwise Query Candidate Scoring",
      "slug": "cross-encoder-reranker",
      "status": "Draft",
      "summary": "A Cross-Encoder Reranker scores query-candidate pairs jointly to support reranking.",
      "version": "1.0.0",
      "visibility": "Public"
    }
  },
  {
    "id": "RETRIEVER-10001",
    "type": "Retriever",
    "label": "Lexical Retriever",
    "sourceDataFile": "data/retrievers/lexical-retriever.json",
    "properties": {
      "capabilities": [
        "Lexical Retrieval"
      ],
      "inputModalities": [
        "Text"
      ],
      "keywords": [
        "lexical retrieval",
        "term matching",
        "keyword retrieval"
      ],
      "language": "en",
      "metadataStatus": "Draft",
      "ragStages": [
        "Retrieval"
      ],
      "retrievalApproach": "Lexical Search",
      "retrievalTargets": [
        "Document",
        "Chunk",
        "Passage"
      ],
      "retrieverType": "Keyword Retriever",
      "reviewState": "Not Reviewed",
      "schema": "schema/retriever.schema.json",
      "slug": "lexical-retriever",
      "status": "Draft",
      "summary": "A Lexical Retriever retrieves candidate records using lexical, term-based, or keyword-oriented matching signals.",
      "version": "1.0.0",
      "visibility": "Public"
    }
  },
  {
    "id": "RETRIEVER-10002",
    "type": "Retriever",
    "label": "Embedding Retriever",
    "sourceDataFile": "data/retrievers/embedding-retriever.json",
    "properties": {
      "capabilities": [
        "Semantic Retrieval"
      ],
      "inputModalities": [
        "Text"
      ],
      "keywords": [
        "embedding retrieval",
        "vector retrieval",
        "semantic retrieval"
      ],
      "language": "en",
      "metadataStatus": "Draft",
      "ragStages": [
        "Retrieval"
      ],
      "retrievalApproach": "Similarity Search",
      "retrievalTargets": [
        "Document",
        "Chunk",
        "Passage"
      ],
      "retrieverType": "Dense Vector Retriever",
      "reviewState": "Not Reviewed",
      "schema": "schema/retriever.schema.json",
      "slug": "embedding-retriever",
      "status": "Draft",
      "summary": "An Embedding Retriever retrieves candidate records by comparing vector or embedding representations.",
      "version": "1.0.0",
      "visibility": "Public"
    }
  },
  {
    "id": "SCHEMA-COMPONENT",
    "type": "Schema",
    "label": "schema/component.schema.json",
    "sourceDataFile": "data/manifest.json",
    "properties": {
      "declaredInManifest": "data/manifest.json",
      "schemaId": "https://rkm.org/schema/component.schema.json",
      "schemaPath": "schema/component.schema.json",
      "title": "RKM Component Schema"
    }
  },
  {
    "id": "SCHEMA-RAG_TECHNIQUE",
    "type": "Schema",
    "label": "schema/rag-technique.schema.json",
    "sourceDataFile": "data/manifest.json",
    "properties": {
      "declaredInManifest": "data/manifest.json",
      "schemaId": "https://rkm.org/schema/rag-technique.schema.json",
      "schemaPath": "schema/rag-technique.schema.json",
      "title": "RKM RAG Technique Schema"
    }
  },
  {
    "id": "SCHEMA-RERANKER",
    "type": "Schema",
    "label": "schema/reranker.schema.json",
    "sourceDataFile": "data/manifest.json",
    "properties": {
      "declaredInManifest": "data/manifest.json",
      "schemaId": "https://rkm.org/schema/reranker.schema.json",
      "schemaPath": "schema/reranker.schema.json",
      "title": "RKM Reranker Schema"
    }
  },
  {
    "id": "SCHEMA-RETRIEVER",
    "type": "Schema",
    "label": "schema/retriever.schema.json",
    "sourceDataFile": "data/manifest.json",
    "properties": {
      "declaredInManifest": "data/manifest.json",
      "schemaId": "https://rkm.org/schema/retriever.schema.json",
      "schemaPath": "schema/retriever.schema.json",
      "title": "RKM Retriever Schema"
    }
  },
  {
    "id": "SCHEMA-VECTOR_DATABASE",
    "type": "Schema",
    "label": "schema/vector-database.schema.json",
    "sourceDataFile": "data/manifest.json",
    "properties": {
      "declaredInManifest": "data/manifest.json",
      "schemaId": "https://rkm.org/schema/vector-database.schema.json",
      "schemaPath": "schema/vector-database.schema.json",
      "title": "RKM Vector Database Schema"
    }
  },
  {
    "id": "TECHNIQUE-10001",
    "type": "Technique",
    "label": "Hybrid Retrieval",
    "sourceDataFile": "data/rag-techniques/hybrid-retrieval.json",
    "properties": {
      "keywords": [
        "keyword retrieval",
        "semantic retrieval",
        "rank fusion"
      ],
      "language": "en",
      "metadataStatus": "Draft",
      "ragStage": [
        "Retrieval",
        "Context Assembly"
      ],
      "reviewState": "Not Reviewed",
      "schema": "schema/rag-technique.schema.json",
      "slug": "hybrid-retrieval",
      "status": "Draft",
      "summary": "Hybrid Retrieval combines candidate sets or scores from multiple retrieval approaches, commonly lexical and semantic retrieval, before context assembly.",
      "techniqueFamily": "Hybrid Retrieval",
      "version": "1.0.0",
      "visibility": "Public"
    }
  },
  {
    "id": "TECHNIQUE-10002",
    "type": "Technique",
    "label": "Query Rewriting",
    "sourceDataFile": "data/rag-techniques/query-rewriting.json",
    "properties": {
      "keywords": [
        "query transformation",
        "query expansion",
        "retrieval query"
      ],
      "language": "en",
      "metadataStatus": "Draft",
      "ragStage": [
        "Query Understanding",
        "Retrieval"
      ],
      "reviewState": "Not Reviewed",
      "schema": "schema/rag-technique.schema.json",
      "slug": "query-rewriting",
      "status": "Draft",
      "summary": "Query Rewriting changes a user query before retrieval so the retrieval step can search with a clearer or more targeted request.",
      "techniqueFamily": "Query Transformation",
      "version": "1.0.0",
      "visibility": "Public"
    }